{
  "schema_version": "RECON-0.1",
  "scenario_id": "B17.reconcile",
  "summary": "按目标期间、批准状态、估值日终版报价及适用汇率逐项核对；四个头寸可确认，四个头寸因授权证据缺失保持未知，故仅报告确认小计。",
  "result": {
    "complete_valuation_sgd": null,
    "confirmed_subtotal_sgd": "480280.00",
    "detail_file": "position_detail.csv",
    "eur_intermediate": "4000",
    "excluded_evidence": [
      "DRAFT_HOLDING",
      "INDICATIVE_QUOTE",
      "SEPTEMBER_HOLDING",
      "WRONG_DATE_FX",
      "WRONG_DATE_QUOTE"
    ],
    "missing_evidence": {
      "U-QUOTE": [
        "FINAL_AS_OF_QUOTE"
      ],
      "U-DRAFT": [
        "APPROVED_OCTOBER_HOLDING"
      ],
      "U-PERIOD": [
        "APPROVED_OCTOBER_HOLDING"
      ],
      "U-EUR-FX": [
        "AS_OF_AUTHORIZED_FX"
      ]
    },
    "period_source": "period",
    "selected_holding_rows": {
      "P-SGD-1": "H-P-SGD-1-CURRENT",
      "P-SGD-4": "H-P-SGD-4-CURRENT",
      "P-EUR-3": "H-P-EUR-3-CURRENT",
      "P-USD-2": "H-P-USD-2-CURRENT"
    },
    "selected_quote_rows": {
      "P-SGD-1": "Q-P-SGD-1-CURRENT",
      "P-SGD-4": "Q-P-SGD-4-CURRENT",
      "P-EUR-3": "Q-P-EUR-3-CURRENT",
      "P-USD-2": "Q-P-USD-2-CURRENT"
    },
    "static_output_acceptable": true,
    "unknown_positions": [
      "U-QUOTE",
      "U-DRAFT",
      "U-PERIOD",
      "U-EUR-FX"
    ]
  },
  "citations": [
    {
      "source_id": "valuation_policy",
      "locator": "data.version_selection; data.holding_period; data.as_of"
    },
    {
      "source_id": "valuation_policy",
      "locator": "data.fx_domains.standard; data.fx_domains.restricted-domain; data.rules"
    },
    {
      "source_id": "holdings-versions",
      "locator": "CSV lines 2-20; selected row IDs and period/status/version_date fields"
    },
    {
      "source_id": "quotes-versions",
      "locator": "CSV lines 2-18; selected row IDs and date/state fields"
    }
  ],
  "executed_actions": []
}
